{
  "schemaVersion": "1.1",
  "id": "opsweave.data-integration",
  "version": "0.0.1",
  "publisher": "trusted-team",
  "compatibility": { "kernelApiMajor": 1, "webSdkMajor": 1 },
  "artifactDigest": "sha256:0000000000000000000000000000000000000000000000000000000000000000",
  "frontend": {
    "remoteEntry": "frontend/remoteEntry.js",
    "remoteEntryDigest": "sha256:0000000000000000000000000000000000000000000000000000000000000000",
    "assetIndex": "frontend/asset-index.json",
    "assetIndexDigest": "sha256:0000000000000000000000000000000000000000000000000000000000000000",
    "contributions": [
      { "kind": "route.page.v1", "id": "integration-page", "path": "/ext/trusted-team/data-integration" },
      { "kind": "navigation.item.v1", "id": "data-integration-nav", "path": "/ext/trusted-team/data-integration" }
    ]
  },
  "backend": {
    "runtime": "oci",
    "imageRef": "localhost:5001/opsweave/data-integration@sha256:0000000000000000000000000000000000000000000000000000000000000000",
    "protocol": { "name": "http-json", "version": "1", "containerPort": 8080 },
    "health": { "readinessPath": "/_opsweave/health/ready", "livenessPath": "/_opsweave/health/live", "startupPath": "/_opsweave/health/startup" },
    "apiPrefix": "/api/data-integration"
  },
  "provides": [{ "name": "data.source.v1", "major": 1 }],
  "requires": [{ "name": "data.catalog.v1", "major": 1 }],
  "permissions": ["data.source.read", "data.source.write", "data.catalog.dataset.write"],
  "resources": { "cpuMillis": 500, "memoryMiB": 128 }
}
