{
  "schemaVersion": "1.1",
  "id": "opsweave.data-catalo",
  "version": "0.0.1",
  "publisher": "trusted-team",
  "compatibility": {
    "kernelApiMajor": 1,
    "webSdkMajor": 1
  },
  "artifactDigest": "sha256:0000000000000000000000000000000000000000000000000000000000000000",
  "frontend": {
    "remoteEntry": "frontend/remoteEntry.js",
    "remoteEntryDigest": "sha256:0000000000000000000000000000000000000000000000000000000000000000",
    "assetIndex": "frontend/asset-index.json",
    "assetIndexDigest": "sha256:0000000000000000000000000000000000000000000000000000000000000000",
    "contributions": [
      {
        "kind": "route.page.v1",
        "id": "catalog-alt-page",
        "path": "/ext/trusted-team/data-catalo"
      },
      {
        "kind": "navigation.item.v1",
        "id": "data-catalog-alt-nav",
        "path": "/ext/trusted-team/data-catalo"
      }
    ]
  },
  "backend": {
    "runtime": "oci",
    "imageRef": "localhost:5001/opsweave/data-catalog@sha256:0000000000000000000000000000000000000000000000000000000000000000",
    "protocol": {
      "name": "http-json",
      "version": "1",
      "containerPort": 8080
    },
    "health": {
      "readinessPath": "/_opsweave/health/ready",
      "livenessPath": "/_opsweave/health/live",
      "startupPath": "/_opsweave/health/startup"
    },
    "apiPrefix": "/api/data-catalog"
  },
  "provides": [
    {
      "name": "data.catalog.v1",
      "major": 1
    }
  ],
  "requires": [],
  "permissions": [
    "data.catalog.dataset.read",
    "data.catalog.dataset.write"
  ],
  "resources": {
    "cpuMillis": 500,
    "memoryMiB": 128
  }
}