{
  "schemaVersion": "1.1",
  "id": "dev.opsweave.hello-java",
  "version": "0.0.1",
  "publisher": "trusted-team",
  "compatibility": { "kernelApiMajor": 1, "webSdkMajor": 1 },
  "artifactDigest": "sha256:0000000000000000000000000000000000000000000000000000000000000000",
  "frontend": null,
  "backend": {
    "runtime": "oci",
    "imageRef": "localhost:5001/opsweave/hello-java@sha256:0000000000000000000000000000000000000000000000000000000000000000",
    "protocol": { "name": "http-json", "version": "1", "containerPort": 8080 },
    "health": {
      "readinessPath": "/_opsweave/health/ready",
      "livenessPath": "/_opsweave/health/live",
      "startupPath": "/_opsweave/health/startup"
    },
    "apiPrefix": "/api/hello"
  },
  "provides": [{ "name": "sample.hello.java.v1", "major": 1 }],
  "requires": [],
  "permissions": ["sample.hello.read"],
  "resources": { "cpuMillis": 750, "memoryMiB": 512 }
}
